{
  "contract_version": "1.0",
  "id_evento": "123e4567-e89b-42d3-a456-426614174116",
  "id_operacion": "123e4567-e89b-42d3-a456-426614174104",
  "tipo": "ESTADO_INSTITUCIONAL_CAMBIADO",
  "entidad": "PERSONA",
  "persona_uuid": "123e4567-e89b-42d3-a456-426614174200",
  "persona_version": 5,
  "origen": "SIGE",
  "ocurrido_en": "2026-08-30 16:15:00",
  "data": {
    "accion": "BAJA_INSTITUCIONAL",
    "alcance": "PERSONA",
    "persona_estado": "INACTIVA",
    "vinculos_habilitantes": 0,
    "vinculos_afectados": [
      {
        "vinculo_uuid": "123e4567-e89b-42d3-a456-426614174201",
        "tipo": "ADMINISTRATIVO",
        "estado": "INACTIVO",
        "cargo": { "id": 8, "nombre_snapshot": "COORDINADOR", "version": 3 },
        "dependencia": { "id": 12, "nombre_snapshot": "BIENESTAR", "version": 2 }
      },
      {
        "vinculo_uuid": "123e4567-e89b-42d3-a456-426614174202",
        "tipo": "DOCENTE",
        "estado": "INACTIVO",
        "cargo": null,
        "dependencia": null
      }
    ],
    "carnet": {
      "sige_carnet_id": 77,
      "uid_rfid": "A1B2C3D4",
      "estado": "INACTIVO",
      "motivo": "BAJA_INSTITUCIONAL",
      "fecha_emision": "2026-08-30 16:03:01",
      "vigencia_hasta": null,
      "entregado_en": null
    },
    "solicitud_talento_humano_id": "TH-2026-001"
  }
}
