{
  "contract_version": "1.0",
  "id_evento": "123e4567-e89b-42d3-a456-426614174105",
  "id_operacion": "123e4567-e89b-42d3-a456-426614174103",
  "tipo": "CARNET_ASIGNADO",
  "entidad": "CARNET",
  "persona_uuid": "123e4567-e89b-42d3-a456-426614174200",
  "persona_version": 4,
  "origen": "SIGE",
  "ocurrido_en": "2026-08-30 16:03:01",
  "data": {
    "sige_carnet_id": 77,
    "uid_rfid": "A1B2C3D4",
    "estado": "ACTIVO",
    "motivo": "NO_APLICA",
    "fecha_emision": "2026-08-30 16:03:01",
    "vigencia_hasta": null,
    "entregado_en": null
  }
}
